{
  "latent_idx": 31149,
  "short_name": "thank_you_and_appreciation",
  "primary_explanation": "The majority of sentences express gratitude or appreciation, often in therapeutic or counseling contexts, using phrases like 'thank you', 'I appreciate', or 'I commend you'.",
  "candidate_behavioral_explanation": "The sentences function as positive reinforcement or rapport-building in a therapeutic or coaching interaction, acknowledging the client's efforts or participation.",
  "explanation_type": "behavioral_function",
  "supporting_sample_ids": ["s001", "s002", "s003", "s008", "s009", "s010", "s011", "s012", "s013", "s014", "s016", "s017", "s019", "s020", "s021", "s022", "s023", "s025", "s026", "s027", "s028", "s029", "s030", "s033", "s034", "s037", "s038", "s039", "s040", "s042", "s043", "s045", "s046", "s047", "s048", "s049", "s050"],
  "outlier_sample_ids": ["s004", "s005", "s006", "s007", "s015", "s018", "s024", "s031", "s032", "s035", "s036", "s041", "s044"],
  "representative_evidence_ids": ["s001", "s008", "s011"],
  "linguistic_evidence": [
    {
      "sample_id": "s001",
      "evidence": "I want to commend you for coming in here today",
      "evidence_level": "pragmatic_function",
      "evidence_role": "support"
    },
    {
      "sample_id": "s008",
      "evidence": "Thank you so much for calling me back",
      "evidence_level": "pragmatic_function",
      "evidence_role": "support"
    },
    {
      "sample_id": "s011",
      "evidence": "thank you very much I really appreciate your time today",
      "evidence_level": "pragmatic_function",
      "evidence_role": "support"
    },
    {
      "sample_id": "s006",
      "evidence": "I am so proud of you that is awesome",
      "evidence_level": "pragmatic_function",
      "evidence_role": "limit"
    },
    {
      "sample_id": "s031",
      "evidence": "guilt definitely sadness joke says yeah any think some anger",
      "evidence_level": "topical",
      "evidence_role": "limit"
    }
  ],
  "alternative_explanations": [
    "The sentences are part of a scripted or routine interaction in a clinical setting, with formulaic expressions of gratitude.",
    "The pattern reflects a mix of closing and opening sequences in conversations, where thanking is common."
  ],
  "possible_confounds": [
    "The dataset may be from a specific domain (e.g., therapy, coaching) where thanking is frequent.",
    "Some sentences are fragments or incomplete, making interpretation ambiguous."
  ],
  "limitations": [
    "Outliers include sentences that are not thanking (e.g., s006, s031) or are ambiguous (e.g., s004, s005).",
    "The behavioral function may be confounded with politeness routines rather than genuine reinforcement."
  ],
  "confidence": 4,
  "confidence_rationale": "The pattern of gratitude and appreciation covers a clear majority of sentences, with consistent lexical and pragmatic markers. Outliers are present but do not undermine the primary interpretation."
}
