{
  "latent_idx": 16256,
  "short_name": "therapeutic_discourse_markers",
  "primary_explanation": "The sentences predominantly feature discourse markers and reflective listening phrases typical of therapeutic or counseling conversations, such as 'it sounds like', 'you know', 'so', and 'I hear you saying', often followed by paraphrasing or summarizing the interlocutor's statements.",
  "candidate_behavioral_explanation": "The primary behavioral function appears to be active listening and reflective responding, common in therapeutic settings, aimed at validating, clarifying, or exploring the speaker's experiences.",
  "explanation_type": "behavioral_function",
  "supporting_sample_ids": ["s001", "s002", "s003", "s004", "s005", "s006", "s007", "s008", "s009", "s010", "s011", "s012", "s013", "s014", "s015", "s016", "s017", "s018", "s019", "s020", "s021", "s022", "s023", "s024", "s025", "s026", "s027", "s028", "s029", "s030", "s031", "s032", "s033", "s034", "s035", "s036", "s037", "s038", "s039", "s040", "s041", "s042", "s043", "s044", "s045", "s046", "s047", "s048", "s049", "s050"],
  "outlier_sample_ids": [],
  "representative_evidence_ids": ["s003", "s010", "s024"],
  "linguistic_evidence": [
    {
      "sample_id": "s003",
      "evidence": "Uses 'I hear you saying' to reflect the speaker's words, a classic therapeutic technique.",
      "evidence_level": "pragmatic_function",
      "evidence_role": "support"
    },
    {
      "sample_id": "s010",
      "evidence": "Contains 'It really does sound, though, like you' followed by a paraphrase, indicating reflective listening.",
      "evidence_level": "pragmatic_function",
      "evidence_role": "support"
    },
    {
      "sample_id": "s024",
      "evidence": "Includes 'right and then with the respect one of the things you mentioned is really wanting to respect yourself' showing summarization and reflection.",
      "evidence_level": "pragmatic_function",
      "evidence_role": "support"
    },
    {
      "sample_id": "s001",
      "evidence": "Uses 'you know' and offers options, typical of a counselor providing choices.",
      "evidence_level": "discourse_marker",
      "evidence_role": "support"
    },
    {
      "sample_id": "s044",
      "evidence": "Contains 'so gosh you're actually really drinking quite a lot' which is a direct but supportive confrontation, common in motivational interviewing.",
      "evidence_level": "pragmatic_function",
      "evidence_role": "support"
    }
  ],
  "alternative_explanations": [
    "The sentences could be from a coaching or advice-giving context, where the speaker offers suggestions and encouragement.",
    "Alternatively, they might represent a mix of casual conversation and professional discourse, with no single consistent function."
  ],
  "possible_confounds": [
    "The sentences are extracted from a larger conversation, so the pattern may be influenced by the specific dialogue context.",
    "Some sentences (e.g., s006, s036) focus on practical advice (diet, lunch options) which could be from a different domain like nutrition counseling."
  ],
  "limitations": [
    "The analysis is based solely on text without prosodic or contextual cues, which are important in therapeutic discourse.",
    "The sample IDs are sequential and may not represent independent utterances, potentially overrepresenting a single conversation."
  ],
  "confidence": 4,
  "confidence_rationale": "The pattern of reflective listening and therapeutic discourse markers is highly consistent across all 50 sentences, with no clear outliers. The alternative explanations are weaker because the majority of sentences exhibit the same pragmatic function."
}
