{
  "latent_idx": 16045,
  "short_name": "first-person present perfect and modal constructions",
  "primary_explanation": "The majority of sentences begin with 'I have', 'I did', 'I would', 'I've', or similar first-person constructions, often in present perfect or modal forms, used in conversational or clinical contexts to express personal experience, intention, or observation.",
  "candidate_behavioral_explanation": "The sentences appear to function as self-disclosures, questions, or directives in therapeutic or medical dialogues, but the pattern is primarily structural rather than functional.",
  "explanation_type": "linguistic_structure",
  "supporting_sample_ids": ["s001", "s002", "s003", "s004", "s005", "s006", "s007", "s008", "s009", "s010", "s011", "s013", "s014", "s015", "s016", "s017", "s018", "s019", "s020", "s021", "s022", "s023", "s024", "s025", "s026", "s027", "s029", "s030", "s031", "s032", "s034", "s035", "s037", "s038", "s039", "s040", "s041", "s042", "s043", "s044", "s045", "s046", "s047", "s048", "s049", "s050"],
  "outlier_sample_ids": ["s012", "s028", "s033", "s036"],
  "representative_evidence_ids": ["s001", "s006", "s043"],
  "linguistic_evidence": [
    {
      "sample_id": "s001",
      "evidence": "Starts with 'I have a lot of thoughts'",
      "evidence_level": "syntactic",
      "evidence_role": "support"
    },
    {
      "sample_id": "s006",
      "evidence": "Starts with 'I have a couple things'",
      "evidence_level": "syntactic",
      "evidence_role": "support"
    },
    {
      "sample_id": "s043",
      "evidence": "Starts with 'I would like to share'",
      "evidence_level": "syntactic",
      "evidence_role": "support"
    },
    {
      "sample_id": "s012",
      "evidence": "Begins with 'inactive so at the moment' - no first-person subject",
      "evidence_level": "syntactic",
      "evidence_role": "limit"
    },
    {
      "sample_id": "s028",
      "evidence": "Begins with 'maybe Panther leading' - no first-person subject",
      "evidence_level": "syntactic",
      "evidence_role": "limit"
    },
    {
      "sample_id": "s033",
      "evidence": "Only 'I also' - incomplete, but still first-person",
      "evidence_level": "syntactic",
      "evidence_role": "support"
    },
    {
      "sample_id": "s036",
      "evidence": "Begins with 'or I will level' - first-person but atypical structure",
      "evidence_level": "syntactic",
      "evidence_role": "limit"
    }
  ],
  "alternative_explanations": [
    "The sentences may reflect a clinical or counseling setting where the speaker is a healthcare provider discussing patient history, medications, or lifestyle changes.",
    "The pattern could be a transcription artifact where speakers frequently use 'I' as a discourse starter, but the variety of verbs (have, did, would, think) suggests genuine structural diversity."
  ],
  "possible_confounds": [
    "The dataset may be drawn from a specific domain (e.g., medical consultations) that naturally uses first-person constructions.",
    "Some sentences are incomplete or contain disfluencies, which may obscure the pattern."
  ],
  "limitations": [
    "A few sentences (s012, s028, s036) do not fit the first-person pattern, indicating the pattern is not universal.",
    "The behavioral function is not clearly stable across all sentences, as some are statements, some questions, and some directives."
  ],
  "confidence": 4,
  "confidence_rationale": "The first-person construction pattern covers the vast majority of sentences (46 out of 50), with only 4 outliers. The pattern is clear and consistent, though alternative interpretations exist."
}
