{
  "latent_idx": 8034,
  "short_name": "okay_so_it_sounds_like",
  "primary_explanation": "A majority of sentences begin with 'okay so it sounds like' or a close variant, followed by a reflective summary or interpretation of the interlocutor's situation, often in a therapeutic or counseling context.",
  "candidate_behavioral_explanation": "The sentences function as reflective listening or summarizing statements, common in motivational interviewing or therapy, where the speaker mirrors or checks understanding of the other person's experience.",
  "explanation_type": "linguistic_structure",
  "supporting_sample_ids": ["s001", "s002", "s003", "s004", "s005", "s006", "s007", "s008", "s009", "s010", "s011", "s012", "s013", "s014", "s015", "s016", "s017", "s018", "s019", "s020", "s021", "s022", "s023", "s024", "s025", "s026", "s027", "s028", "s029", "s030", "s031", "s032", "s033", "s034", "s035", "s036", "s037", "s038", "s039", "s040", "s041", "s042", "s043", "s044", "s045", "s046", "s047", "s048", "s049", "s050"],
  "outlier_sample_ids": [],
  "representative_evidence_ids": ["s004", "s009", "s014"],
  "linguistic_evidence": [
    {
      "sample_id": "s004",
      "evidence": "Starts with 'Wow okay so it sounds like' and provides a reflective summary.",
      "evidence_level": "discourse_marker",
      "evidence_role": "support"
    },
    {
      "sample_id": "s009",
      "evidence": "Starts with 'okay so it feels like' which is a variant of the pattern, summarizing the interlocutor's feelings.",
      "evidence_level": "syntactic",
      "evidence_role": "support"
    },
    {
      "sample_id": "s014",
      "evidence": "Starts with 'okay so it sounds like' and elaborates on the interlocutor's thoughts.",
      "evidence_level": "discourse_marker",
      "evidence_role": "support"
    }
  ],
  "alternative_explanations": [
    "The sentences may be part of a structured interview or questionnaire where the interviewer paraphrases responses.",
    "The pattern could reflect a conversational routine in a specific domain like health coaching or addiction counseling."
  ],
  "possible_confounds": [
    "The dataset may be drawn from a single conversation or transcript, artificially inflating the pattern's prevalence.",
    "Some sentences (e.g., s028, s030) lack the 'okay so' opener but still fit the reflective function, suggesting the pattern is not perfectly uniform."
  ],
  "limitations": [
    "The analysis is based solely on surface form; deeper pragmatic function may vary across sentences.",
    "Without context, it is unclear whether all sentences are from the same speaker or interaction."
  ],
  "confidence": 4,
  "confidence_rationale": "The pattern is highly consistent across the majority of sentences, with clear lexical and discourse markers. Alternative explanations are weaker, and confounds are manageable."
}
