{
  "latent_idx": 18490,
  "short_name": "weight_health_discourse",
  "primary_explanation": "The sentences predominantly discuss weight, obesity, diabetes, and related health risks, often in the context of advice, information, or patient-provider dialogue about lifestyle changes such as diet and exercise.",
  "candidate_behavioral_explanation": "The sentences appear to function as a health counseling or educational discourse, where a provider informs, advises, or motivates a patient about weight management and its impact on conditions like diabetes and hypertension.",
  "explanation_type": "topic",
  "supporting_sample_ids": ["s001","s002","s003","s004","s005","s006","s007","s008","s009","s010","s011","s012","s013","s014","s015","s016","s017","s018","s019","s020","s021","s022","s023","s024","s025","s026","s027","s028","s029","s030","s031","s032","s033","s034","s035","s036","s037","s038","s039","s040","s041","s042","s043","s044","s045","s046","s047","s048"],
  "outlier_sample_ids": ["s049","s050"],
  "representative_evidence_ids": ["s001","s003","s008"],
  "linguistic_evidence": [
    {
      "sample_id": "s001",
      "evidence": "obesity can lead to many chronic conditions",
      "evidence_level": "topical",
      "evidence_role": "support"
    },
    {
      "sample_id": "s003",
      "evidence": "if you loss weight, it will lessen the risk of getting these diseases",
      "evidence_level": "topical",
      "evidence_role": "support"
    },
    {
      "sample_id": "s008",
      "evidence": "discuss the potential health risks associated with weight gain and overeating junk food",
      "evidence_level": "pragmatic_function",
      "evidence_role": "support"
    },
    {
      "sample_id": "s049",
      "evidence": "hey Monica how are you doing today",
      "evidence_level": "pragmatic_function",
      "evidence_role": "contradict"
    },
    {
      "sample_id": "s050",
      "evidence": "you really want to go to Black Friday with your friends",
      "evidence_level": "topical",
      "evidence_role": "contradict"
    }
  ],
  "alternative_explanations": [
    "The sentences may reflect a motivational interviewing style, where the provider elicits patient concerns and reinforces change talk.",
    "The pattern could be a collection of clinical notes or transcripts from a weight management or diabetes education session."
  ],
  "possible_confounds": [
    "The dataset may include multiple speakers (provider and patient), making it difficult to isolate a single discourse function.",
    "Some sentences are incomplete or contain transcription artifacts (e.g., repeated words, placeholders like 'UH' or 'pounds')."
  ],
  "limitations": [
    "Two sentences (s049, s050) are unrelated to the health topic, suggesting possible topic shifts or noise.",
    "The behavioral function is inferred but not explicitly marked; the sentences could also be from a scripted dialogue."
  ],
  "confidence": 4,
  "confidence_rationale": "The topic of weight, obesity, diabetes, and health management is highly consistent across 48 of 50 sentences, with only two outliers. The pattern is clear and stable, though the exact behavioral function (e.g., counseling vs. education) is not uniquely determined."
}
